Query,Año,Citas,Type,Titulo,Abstract,Revista_or_evento,a_1,a_2,a_3,a_4,a_5,a_6,a_7,a_8,a_9,a_10,a_11,a_12,a_13,a_14
"""soccer"" and ""analytics"" and ""world""",2014,59,Article,Statistical analysis for the soccer matches of the first Bundesliga,"Statistical analysis for the soccer matches of the First Bundesliga; i.e., the first national soccer league of Germany, during the period Aug. 5 to Nov. 27, 2011 is made in order to see which parameters are more important for the result of a match. It is found that the goal efficiency, defined by the number of goals divided by the number of shots, is by far the most important parameter. The parameters of the second to the fourth importance are the number of shots, the number of passes and the number of ball contacts respectively. The present analysis shows that the quality of shots, represented by the goal efficiency, is more important than the quantity of shots for winning a soccer game. Regarding the long time dispute over the issue whether “direct play” or “possession play” is more effective, the present result favours “direct play” because it has higher goal efficiency compared to “possession play” according to the literature. Nevertheless, the length of passing sequence may not be the major factor related to the goal efficiency. Effective use of team possessions to create favourable shooting conditions may be more important for raising the goal efficiency. Much further analysis remains to be carried out in this direction.",International Journal of Sports Science & Coaching,"Yue, Z.","Broich, H.","Mester, J.",-,-,-,-,-,-,-,-,-,-,-
"""soccer"" and ""analytics"" and ""world""",2014,27,Article,Beating the bookmakers: leveraging statistics and Twitter microposts for predicting soccer results,"In this paper, we investigate the feasibility of using collec- tive knowledge for predicting the winner of a soccer game. Specifically, we developed different methods that extract and aggregate the information contained in over 50 million Twitter microposts to predict the outcome of soccer games, considering methods that use the Twitter volume, the sen- timent towards teams and the score predictions made by Twitter users. Apart from collective knowledge-based pre- diction methods, we also implemented traditional statistical methods. Our results show that the combination of different types of methods using both statistical knowledge and large sources of collective knowledge can beat both expert and bookmaker predictions. Indeed, we were for instance able to realize a monetary profit of almost 30% when betting on soccer games of the second half of the English Premier League 2013-2014.",KDD Workshop on Large-Scale Sports Analytics,"Godin, F.","Zuallaert, J.","Vandersmissen, B.","De Neve, W.","Van de Walle, R.",-,-,-,-,-,-,-,-,-
"""soccer"" and ""analytics"" and ""world""",2015,30,Article,"Mixed-initiative social media analytics at the World Bank: Observations of citizen sentiment in Twitter data to explore ""trust"" of political actors and state institutions and its relationship to social protest","This paper discusses a project that studied the relationship between citizen trust and social protest using visual analysis of approximately 11 million sentiment classified Tweets from the period of the 2014 Brazilian World Cup. The results of the study reveal that the 2014 World Cup protests in Brazil sprang from a wide range of grievances coupled with a relative sense of deprivation compared with emergent comparative `standards'. This sense of grievance gave rise to sentiments that activated online protest that may have led to other forms of social protest, such as demonstrations. The paper describes an innovative approach to big data analytics-mixed initiative social media analytics - and discusses the potential of using big data in social science research of this kind, as well as some of the open methodological, technical and ethical issues still to be addressed.",2015 IEEE International Conference on Big Data (Big Data),"Calderon, N. A.","Fisher, B.","Hemsley, J.","Ceskavich, B.","Jansen, G.","Marciano, R.","Lemieux, V. L.",-,-,-,-,-,-,-
"""soccer"" and ""analytics"" and ""world""",2013,8,Article,Analysis of a real-world HTTP segment streaming case,"Today, adaptive HTTP segment streaming is a popular way to deliver video content to users. The benefits of HTTP segment streaming include its scalability, high performance and easy deployment, especially the possibility to reuse the already deployed HTTP infrastructure. However, current research focuses merely on client side statistics like for example achieved video qualities and adaption algorithms. To quantify the properties of such streaming systems from a service provider point of view, we have analyzed both sender and receiver side logging data provided by a popular Norwegian streaming provider. For example, we observe that more than 90% of live streaming clients send their requests for the same video segment with an inter-arrival time of only 10 seconds. Moreover, the logs indicate that the server sends substantially less data than is actually reported to be received by the clients, and the origin server streams data to less clients than there really are. Based on these facts, we conclude that HTTP segment streaming really makes use of the HTTP cache infrastructure without the need to change anything in the parts of Internet that are not controlled by the streaming provider.",Proceedings of the 11th European Conference on Interactive TV and Video,"Kupka, T.","Griwodz, C.","Halvorsen, P.","Johansen, D.","Hovden, T.",-,-,-,-,-,-,-,-,-
"""soccer"" and ""analytics"" and ""world""",2015,16,Article,Social set visualizer: A set theoretical approach to big social data analytics of real-world events,"Current state-of-the-art in big social data analytics is largely limited to graph theoretical approaches such as social network analysis (SNA) informed by the social philosophical approach of relational sociology. This paper proposes and illustrates an alternate holistic approach to big social data analytics, social set analysis (SSA), which is based on the sociology of associations, mathematics of set theory, and advanced visual analytics of event studies. We illustrate our new approach by applying it to relate real-world events with their reflections in terms of user interactions on social media platforms. We present and discuss a theoretical and conceptual model of social data followed by a formal description of our technique based on set theory and event studies with a real-world social data example from Facebook. We then illustrate our new approach by reporting on the design, development, and evaluation results of a state-of-the-art visual analytics dashboard, the Social Set Visualizer (SoSeVi). Using SoSeVi, we conducted a real-world case study that consists of approximately 90 million Facebook user interactions from 11 different companies that have been mentioned in the traditional media in relation to the garment factory accidents in Bangladesh, and analyze the results. The enterprise application domain for the dashboard is corporate social responsibility (CSR) and the targeted end-users are CSR researchers and practitioners. The design of the dashboard was based on the social set analysis approach to computational social science mentioned above. The development of the dashboard involved cutting-edge open source visual analytics libraries (D3.js) and creation of new visualizations such as of actor mobility across time and space, conversational comets, and more. Evaluation of the dashboard consisted of technical testing, usability testing, and domain-specific testing with CSR students and yielded positive results. In conclusion, we discuss the new analytical approach of social set analysis and conclude with a discussion of the benefits of set theoretical approaches based on the social philosophical approach of associational sociology.",015 IEEE International Conference on Big Data (Big Data),"Flesch, B.","Vatrapu, R.","Mukkamala, R. R.","Hussain, A.",-,-,-,-,-,-,-,-,-,-
"""soccer"" and ""analytics"" and ""world""",2014,9,Article,Skill importance in women’s soccer,"Soccer analytics often follow one of two approaches: 1) regression models on number of shots taken or goals scored to predict match winners, or 2) spatial and/or temporal analysis of plays for evaluation of strategy. We propose a new model to evaluate skill importance in soccer. Play by play data were collected on 22 NCAA Division I Women’s Soccer matches with a new skill notation system. Using a Bayesian approach, we model play sequences as discrete absorbing Markov chains. Using posterior distributions, we estimate the probability of 35 distinct offensive skills leading to a shot during a single possession.",Journal of Quantitative Analysis in Sports,"Heiner, M.","Fellingham, G. W.","Thomas, C.",-,-,-,-,-,-,-,-,-,-,-
"""soccer"" and ""analytics"" and ""world""",2015,22,Article,Healthcare informatics and analytics framework,"Healthcare industry is constantly undergoing changes owing to the advancements made in its medical and technological dimensions. Healthcare Informatics has evolved over decades by leveraging upon best of the computer technologies available. It has come a long way from being just a database to a comprehensive source of useful information for analytics and research. Emergence of technology paradigms like Big Data, Internet of Things (IoT), Complex Even Processing (CEP), Cloud Computing etc are changing the way things were. Healthcare informatics is now at juncture to find a complete solution to all its woes by adopting an integrated solution framework based on Big Data, IoT and CEP. This paper proposes one such framework which can act as reference for implementing a holistic healthcare informatics and analytics ecosystem.",2015 International Conference on Computer Communication and Informatics (ICCCI),"Sheriff, C. I.","Naqishbandi, T.","Geetha, A.",-,-,-,-,-,-,-,-,-,-,-
Machine learning SCIENTIST IN THE SOCCER,2020,19,Article,A Machine Learning Approach to Assess Injury Risk in Elite Youth Football Players,"To assess injury risk in elite-level youth football players based on anthropometric, motor coordination and physical performance measures with a machine learning approach.",Medicine and science in sports and exercise,"Rommers, N.,","Rössler, R.","Verhagen, E.","Vandecasteele, F.","Verstockt, S.","Vaeyens, R.","Witvrouw, E",-,-,-,-,-,-,-
soccer and economics impacts,2017,7,Article,Rivalries in US Professional Soccer,"This paper investigates factors that contribute to attendance in Major League Soccer with a primary focus on the effect of repeat rivalry matches during a season. Using ordinary least squares, a panel of 2,193 matches (6 seasons) finds significant effects for a variety of match determinants including how rivalries are defined in the estimation. With an increased focus on creating rivalries, the data supports potential diminishing returns from overscheduling of rivalry matches.",Rivalries in US professional soccer.,"Wooten, J. (2017).",-,-,-,-,-,-,-,-,-,-,-,-,-
Machine learning SCIENTIST IN THE SOCCER,2018,1,Article,Prediction learning model for soccer matches outcomes,"Sport is a global business into which passionate fans and smart corporations pour hundreds of billions of dollars. Particularly, football soccer detonates a great movement of money in bets, sponsorships, attendance to parties, sale of t-shirts and accessories, etc. Professional soccer has been in the market for quite some time. The sports management of soccer is awash with data, which has allowed the generation of several metrics associated with the individual and team performance. The aim is to find mechanisms to obtain competitive advantages. In this paper, we propose a procedure for predicting the outcome of a soccer match. The procedure consist of a Bayesian Model based on rank position along with a Machine Learning Model based on historical data of matches. The procedure was tested using a data set containing the results of over 200,000 soccer matches from different soccer leagues around the world and for predicting the outcome of the FIFA world cup 2018. The results shoed an improvement in accuracy and rank probability error compared with other methodologies.",In 2018 Seventeenth Mexican International Conference on Artificial Intelligence,"Hervert-Escobar, L.","Matis, T. I.","Hernandez-Gress, N.",-,-,-,-,-,-,-,-,-,-,-
data science in soccer,2016,287,Article,Big data and tactical analysis in elite soccer: future challenges and opportunities for sports science,"Increasingly tactical decision making in elite soccer is also investigated using machine learning (ML) algorithms based on game position data (Bialkowski et al. 2014a, b; Fernando et al. 2015; Xinyu et al. 2013). Machine learning algorithms allow to identify specific data patterns in large datasets by building an a priori unknown model from the data (Haykin 2009; Jordan and Mitchell 2015; Waljee and Higgins 2010).",Springerplus,"Rein, R.","Memmert, D.",-,-,-,-,-,-,-,-,-,-,-,-
soccer graphs analysis,2018,24,Article,Data-driven visual performance analysis in soccer: An exploratory prototype,"In soccer, understanding of collective tactical behavior has become an integral part in sports analysis at elite levels. Evolution of technology allows collection of increasingly larger and more specific data sets related to sport activities in cost-effective and accessible manner. All this information is minutely scrutinized by thousands of analysts around the globe in search of answers that can in the long-term help increase the performance of individuals or teams in their respective competitions. As the volume of data increases in size, so does the complexity of the problem and the need for suitable tools that leverage the cognitive load involved in the investigation. It is proven that visualization and computer-vision techniques, correctly applied to the context of a problem, help data analysts focus on the relevant information at each stage of the process, and generally lead to a better understanding of the facts that lie behind the data. In the current study, we presented a software prototype capable of assisting researchers and performance analysts in their duty of studying group collective behavior in soccer games and trainings. We used geospatial data acquired from a professional match to demonstrate its capabilities in two different case studies. Furthermore, we successfully proved the efficiency of the different visualization techniques implemented in the prototype and demonstrated how visual analysis can effectively improve some of the basic tasks employed by sports experts on their daily work, complementing more traditional approaches.",Frontiers in Psychology,"Benito Santos, A","Theron, R.","Losada, A.","Sampaio, J. E.","Lago-Peñas, C.",-,-,-,-,-,-,-,-,-
soccer graphs anyltics,2020,3,Article,CAVA: A Visual Analytics System for Exploratory Columnar Data Augmentation Using Knowledge Graphs,"Most visual analytics systems assume that all foraging for data happens before the analytics process; once analysis begins, the set of data attributes considered is fixed. Such separation of data construction from analysis precludes iteration that can enable foraging informed by the needs that arise in-situ during the analysis.",IEEE Transactions on Visualization and Computer Graphics,"Cashman, D.","Das, S.","Heimerl, F.","Liu, C.","Humayoun, S. R.","Chang, R.","Xu, S.",-,-,-,-,-,-,-
Machine learning IN THE SOCCER,2016,34,Article,Using machine learning to draw inferences from pass location data in soccer,"In this paper, we present two approaches to analyzing pass event data to uncover sometimes-nonobvious insights into the game of soccer. We illustrate the utility of our methods by applying them to data from the 2012–2013 La Liga season. We first show that teams are characterized by where on the pitch they attempt passes, and can be identified by their passing styles. Using heatmaps of pass locations as features, we achieved a mean accuracy of 87% in a 20-team classification task. We also investigated using pass locations over the course of a possession to predict shots. For this task, we achieved an area under the receiver operating characteristic (AUROC) of 0.785.","The ASA Data Science Journal,","Brooks, J.","Kerr, M.","Guttag, J.",-,-,-,-,-,-,-,-,-,-,-
Machine learning IN THE SOCCER,2017,14,Article,Effective injury prediction in professional soccer with GPS data and machine learning,"We show that our injury predictors are both accurate and interpretable by providing a set of case studies of interest to soccer practitioners. Our approach opens a novel perspective on injury prevention, providing a set of simple and practical rules for evaluating and interpreting the complex relations between injury risk and training performance in professional soccer.","stat, 1050, 23","Rossi, A.","Pappalardo, L.","Cintia, P.","Iaia, F.","Fernández, J.","Medina, D",-,-,-,-,-,-,-,-
Machine learning IN THE SOCCER,2018,42,Article,QUANTIFYING THE RELATION BETWEEN PERFORMANCE AND SUCCESS IN SOCCER,"In this study, we analyze more than 6000 games and 10 million events in six European leagues and investigate this relation in soccer competitions. We discover that a team’s position in a competition’s final ranking is significantly related to its typical performance, as described by a set of technical features extracted from the soccer data. Moreover, we find that, while victory and defeats can be explained by the team’s performance during a game, it is difficult to detect draws by using a machine learning approach.",Advances in Complex Systems,"Pappalardo, L.","Cintia, P",-,-,-,-,-,-,-,-,-,-,-,-
Machine learning IN THE SOCCER,2017,5,Article,Predicting soccer match outcome using machine learning algorithms,"The aim of this study is to predict the results of soccer matches of the Italian Serie A TIM championship finished with a draw at the end of the first half using mainly descriptive matchstatistics collected during the first half. Moreover we aim to showing the usefulness of these match-statistics. The analysed dataset contains the results of matches played during the second half of season 2014-2015 and the first half of season 2015-2016. Due to the randomness of data and the existence of complex interacting factors, the prediction of soccer match outcomes translates into a hard three-class classification problem (i.e. the Home Win, the Draw or the Away Win). Indeed, the construction of a reliable predictive model is complicated by the limited number of overall available examples and by the even smaller number of instances of the Away win class which makes the dataset unbalanced.",Proceedings of MathSport International,"Liti, C.","Piccialli, V.","Sciandrone, M.",-,-,-,-,-,-,-,-,-,-,-
"""soccer"" and ""analytics"" and ""world""",2014,0,Article,Performance analysis of the2014 FIFA World Cup group stage,"This report evaluates the performances of the countries in the2014 FIFA World Cup group stage by comparing each country’s ex-pected performances with their actual performances. We investigatethe performances in the individual matches as well as aggregates percountry and per region. While the sample size is small, the statisticsseem to confirm the perceptions that teams from the Americas havegenerally performed well and exceeded expectations.","Van Haaren, Jan, and Jesse Davis. ""Performance analysis of the 2014 FIFA World Cup group stage."" CW Reports (2014).","Van Haaren, J.","Davis, J.",-,-,-,-,-,-,-,-,-,-,-,-
"""soccer"" and ""analytics"" and ""world""",2014,21,Article,Mathematical programming as a tool for virtual soccer coaches: a case study of a fantasy sport game,"General awareness of the potential of mathematics to support sports decision making has been raised by the movie “Moneyball” through its portrayal of a real professional American baseball club that used mathematical tools to improve team performance. This article addresses the same challenge using as a test case a fantasy sport game organized by an Argentinian newspaper. Two mathematical programming models are presented that act as virtual coaches that choose a virtual team lineup for each round of the real Argentinian soccer league. The a priori design creates a competitive team for the game, while the a posteriori model determines what would have been its optimal lineup once the season is over and all the results are known. The a priori model was entered in the fantasy game, achieving results that positioned it among the highest scoring participants. Further development of such models would provide useful tools for supporting decision making by coaches or managers of real sports.",International Transactions in Operational Research,"Bonomo, F.","Durán, G.","Marenco, J.",-,-,-,-,-,-,-,-,-,-,-
"""soccer"" and ""analytics"" and ""world""",2014,9,Article,Muithu: A touch-based annotation interface for activity logging in the norwegian premier league,"Annotation of content is a key enabling technology for multimedia systems development. In this demonstration, we present a real-time activity annotation interface designed to be intuitive while imposing minimum effort on the user. Our solution is to use a smartphone and implement a tile-based touch interface. The interface was developed as a part of a larger project in collaboration with Tromsø IL, one of the top soccer teams in Norway. In this demonstration submission we present and evaluate the annotation interface of Muithu.",International Conference on Multimedia Modeling,"Stenhaug, M.","Yang, Y.","Gurrin, C.","Johansen, D.",-,-,-,-,-,-,-,-,-,-
"""soccer"" and ""analytics"" and ""world""",2015,18,Article,Sports (betting) integrity: Detecting match-fixing in soccer,no_abstract,Gaming Law Review and Economics,"Feustel, E. D.","Rodenberg, R. M.",-,-,-,-,-,-,-,-,-,-,-,-
"""soccer"" and ""analytics"" and ""world""",2015,1,Thesis,The Science of Recruitment and Team Selection: Practitioner Methodology In Performance Analytics,"Due to the absence of research regarding performance analytics, in relation to contextual matters of recruitment and team selection. The purpose was to provide a rich insight into performance analytics methodology within selection and recruitment. A mixed methods paradigmatic orientation was adopted through a series of in depth, questionnaires, semi structured interviews and cyberethography. The interview (N= 9) and questionnaire (N= 12) was completed by practitioners, providing an insight into analytical methodology in a variety of sport (N= 9). The interview, questionnaires and cyberethography material, was subject to the process of thematic analysis to configure properties. The resultant analysis illustrated six categorical themes: (1) Analytical processes in recruitment and selection, (2) analytical mapping of practice, (3) statistical methodology, (4) infrastructure of performance systems that support analytical practice (5) measuring the effectiveness of practice in recruitment and selection (6) future developments. Further reflection was given to wider intentions embedded in practitioner methodology to pedagogical, delivery and mental sharing models endowing a valuable lens to functionaries of the process. Ensuing, the broadening relevance, real world application and methodological infrastructure that underpins team selection and recruitment. The article concludes suggesting that future research should yield a short and long-term perspective pursuing this new dialogue in performance analytics.",Cardiff Metropolitan University,"Coles, J.",-,-,-,-,-,-,-,-,-,-,-,-,-
"""soccer"" and ""analytics"" and ""world""",2014,11,Book,Heuristics in analytics: A practical perspective of what influences our analytical world,no_abstract,John Wiley & Sons,"Pinheiro, C. A. R.","McNeill, F.",-,-,-,-,-,-,-,-,-,-,-,-
"""soccer"" and ""analytics"" and ""world""",2014,18,Article,The influence of match status on attacking patterns of play in elite soccer teams,"The attacking performance in elite soccer is a complex process that is influenced by several situational variables, such as match status. The objective of this study was to investigate the influence of match status on the configuration of attacking patterns of play performed by elite soccer teams based on the analysis of matches played by the semi-finalists of the 2010 FIFA World Cup. We observed 28 matches, 7 per semi-finalist team of the 2010 FIFA World Cup, resulting in 1938 attacks, further ordered according to match status (winning, drawing or losing). The SoccerEye observational instrument, SoccerEye recording software (version 3.2), and SDIS-GSEQ analysis software (version 5.1) were used. The national teams of Germany, Netherlands and Uruguay showed more difficulty in scoring goals while losing the match, although they scored after a positive crossing or after a free kick committed by the opposing team. The national team of Spain tended to shoot into the opponent goal after short passing, in both losing and winning situations. We conclude that attacking patterns of play were influenced by match status in the 2010 FIFA World Cup, with the exception of Spanish national team, which tended to use an indirect style of play with no dependence on match status.",Revista Brasileira de Cineantropometria & Desempenho Humano,"Machado, J. C.","Barreira, D.","Garganta, J.",-,-,-,-,-,-,-,-,-,-,-
