Query,Año,Citas,Type,Titulo,Abstract,Revista_or_evento,a_1,a_2,a_3,a_4,a_5,a_6,a_7,a_8,a_9,a_10,a_11,a_12,a_13,a_14
"""soccer"" and ""analytics"" and ""world""",2014,89,Article,Feature-driven visual analytics of soccer data,"Soccer is one the most popular sports today and also very interesting from an scientific point of view. We present a system for analyzing high-frequency position-based soccer data at various levels of detail, allowing to interactively explore and analyze for movement features and game events. Our Visual Analytics method covers single-player, multi-player and event-based analytical views. Depending on the task the most promising features are semi-automatically selected, processed, and visualized. Our aim is to help soccer analysts in finding the most important and interesting events in a match. We present a flexible, modular, and expandable layer-based system allowing in-depth analysis. The integration of Visual Analytics techniques into the analysis process enables the analyst to find interesting events based on classification and allows, by a set of custom views, to communicate the found results. The feedback loop in the Visual Analytics pipeline helps to further improve the classification results. We evaluate our approach by investigating real-world soccer matches and collecting additional expert feedback. Several use cases and findings illustrate the capabilities of our approach.",2014 IEEE conference on visual analytics science and technology (VAST),"Sacha, D","Stein, M.","Schreck, T","Keim, D.","Deussen, O.",-,-,-,-,-,-,-,-,-
"""soccer"" and ""analytics"" and ""world""",2015,35,Article,Visual Soccer Analytics: Understanding the Characteristics of Collective Team Movement Based on Feature-Driven Analysis and Abstraction,"With recent advances in sensor technologies, large amounts of movement data have become available in many application areas. A novel, promising application is the data-driven analysis of team sport. Specifically, soccer matches comprise rich, multivariate movement data at high temporal and geospatial resolution. Capturing and analyzing complex movement patterns and interdependencies between the players with respect to various characteristics is challenging. So far, soccer experts manually post-analyze game situations and depict certain patterns with respect to their experience. We propose a visual analysis system for interactive identification of soccer patterns and situations being of interest to the analyst. Our approach builds on a preliminary system, which is enhanced by semantic features defined together with a soccer domain expert. The system includes a range of useful visualizations to show the ranking of features over time and plots the change of game play situations, both helping the analyst to interpret complex game situations. A novel workflow includes improving the analysis process by a learning stage, taking into account user feedback. We evaluate our approach by analyzing real-world soccer matches, illustrate several use cases and collect additional expert feedback. The resulting findings are discussed with subject matter experts",ISPRS International Journal of Geo-Information,"Stein, M.","Häußler, J.","Jäckle, D.","Janetzko, H.","Schreck, T.","Keim, D.",-,-,-,-,-,-,-,-
"""soccer"" and ""analytics"" and ""world""",2013,35,Thesis,Machine Learning for Soccer Analytics,"Sports analytics has been successfully applied in sports like baseball and basketball. However, its application in soccer has been limited. Research in soccer analytics with Machine Learning techniques is limited and is mostly employed only for predictions. There is a need to find out if the application of Machine Learning can bring better and more insightful results in soccer analytics. In this thesis, we perform descriptive as well as predictive analysis of soccer matches and player performances. In soccer, it is popular to rely on ratings by experts to assess a player’s performance. However, the experts do not unravel the criteria they use for their rating. We attempt to identify the most important attributes of player’s performance which determine the expert ratings. In this way we find the latent knowledge which the experts use to assign ratings to players. We performed a series of classifications with three different pruning strategies and an array of Machine Learning algorithms. The best results for predicting ratings using performance metrics had mean absolute error of 0.17. We obtained a list of most important performance metrics for each of the four playing positions which approximates the attributes considered by the experts for assigning ratings. Then we find the most influential performance metrics of the players for determining the match outcome and we examine the extent to which the outcome is characterised by the performance attributes of the players. We found 34 performance attributes using which we can predict the match outcome with an accuracy of 63.4%. Next, we devise a method to aggregate individual player ratings to produce a set of team ratings and investigate how closely these team ratings can determine the match outcome. We create 27 different team rating attributes, and using 8 of these attributes aggregated over the player ratings for the current match we obtained a prediction accuracy of 90%. This indicates that the expert ratings are influenced by the match outcome. Then we use a weighted average method to aggregate team ratings over past match performances. We find that match outcomes are best characterised by the ratings for the current match. Next, we investigate how well the expert ratings for the past performances of players predict the next match outcome. We find that we could only manage a prediction accuracy of 53.4% because of the unpredictability of ‘draw’. We conclude that the outcome of a match is correlated to the ratings for the current match only.",University of Leuven,"Kumar, G.",-,-,-,-,-,-,-,-,-,-,-,-,-
"""soccer"" and ""analytics"" and ""world""",2014,64,Article,Bagadus: An integrated real-time system for soccer analytics,"The importance of winning has increased the role of performance analysis in the sports industry, and this underscores how statistics and technology keep changing the way sports are played. Thus, this is a growing area of interest, both from a computer system view in managing the technical challenges and from a sport performance view in aiding the development of athletes. In this respect, Bagadus is a real-time prototype of a sports analytics application using soccer as a case study. Bagadus integrates a sensor system, a soccer analytics annotations system, and a video processing system using a video camera array. A prototype is currently installed at Alfheim Stadium in Norway, and in this article, we describe how the system can be used in real-time to playback events. The system supports both stitched panorama video and camera switching modes and creates video summaries based on queries to the sensor system. Moreover, we evaluate the system from a systems point of view, benchmarking different approaches, algorithms, and trade-offs, and show how the system runs in real time.","ACM Transactions on Multimedia Computing, Communications, and Applications (TOMM)","Stensland, H. K.","Gaddam, V. R","Tennøe, M.","Helgedagsrud, E.","Næss, M.","Alstad, H. K.","Mortensen, A.","Langseth, R.","Ljødal, S.","Landsverk, Ø.","Griwodz, C.","Halvorsen, P.","Stenhaug, M.","Johansen, D."
"""soccer"" and ""analytics"" and ""world""",2014,0,Article,World Cup sets US live streaming record,"The world cup has become the most streamed live sporting event in the US, as Americans tune in to this year´s tournament on their smartphones, tablets and computers in record numbers.",FGV Digital Respository,"Bond, S.",-,-,-,-,-,-,-,-,-,-,-,-,-
"""soccer"" and ""analytics"" and ""world""",2015,1,Article,B-FASST': A Statistical and Spatial Analysis System to Evaluate Player Performance in Soccer,"Despite soccer being the number one sport in the world in many respects, the “beautiful game” still lags behind other sports in terms of analytics. We propose the FASST system (Football Analytics: Spatial and Statistical) as an instrument to evaluate player performance. In the basic FASST (BFASST) system, a plus/minus-metric subtracts goals conceded from goals scored for each player while on the pitch. Key improvements to the established hockey plus/minus-metric include control for opponents’ strength and for the importance of a goal helping to identify key players. While the plus/minus-metric identifies key players, the spatial portion provides reasons for the players’ performances adding to established spatial mapping techniques. This allows for valid comparisons of a team’s performance when a player was on/off the pitch. The dependent variables evaluating a player’s performance in B-FASST’s spatial analytics are team shots for/against. Maps were created representing the difference between when a player was on/off the pitch which identifies differences in the distribution of shots for/against under different scenarios. When the components of B-FASST work in concert, one can test specific hypotheses. As an example, we show Franck Ribéry’s (Bayern Munich) performance depends strongly on who is playing left back behind him.",SSRN 2643041,"Schultze, S.","Wellbrock, C.M.",-,-,-,-,-,-,-,-,-,-,-,-
"""soccer"" and ""analytics"" and ""world""",2014,0,Article,Representative Design and Performance Analysis in Soccer,"The aim of this paper is to show how evaluation of the tactical demands of training exercises and its comparison with match performance can improve the understanding of players and teams’ performance. For that, based on the concept of representative design of practice tasks we present some issues that need to be considered to measure and compare the spatial-temporal relations that sustain the tactical behaviors of players and teams in training exercises and competition.",Journal of Performance Analysis in Sport,"Travassos, B.",-,-,-,-,-,-,-,-,-,-,-,-,-
"""soccer"" and ""analytics"" and ""world""",2014,0,Article,Temporal Analysis of Losing Possession of the Ball Leading to Conceding a Goal: A Study of the Incidence of Perturbation in Soccer,"The aim of this study was to examine the temporal occurrence of losing possession of the ball in soccer and its association with conceding a goal. Thirty two senior national teams competing in the 2010 World-Cup in South Africa and twelve youth soccer clubs were selected for match analysis. The results of time distribution analysis showed a significant positive skewness (K-SZ =3, S=0.463, p=0.000) for losing possession of the ball, transition time in senior (K-SZ =1.82, S=1.57, p=0.003) and youth groups (K-SZ =2.85, S=1.29, p=0.002) and normal distribution for variability of time to losing the ball (K-SZ =1.07, S= ?0.280, p=0.19). The results of an independent t test showed that there was a significant difference (t=2.71, p=0.008) in transition time between youth and senior groups. In conclusion, this study showed that the number of times that the ball was lost increased near to a goal being conceded and the duration of the most recent loss was very close to goal-conceding. Thus effective strategies that have been employed to destabilise opponents include increasing the number of perturbations through losing possession of the ball, speeding up the transition periods and the final strike after the opponents lose the ball.",International Journal of Sports Science & Coaching,"Shafizadeh, M.","Lago-Penas, C.","Gridley, A.","Platt, G. K.",-,-,-,-,-,-,-,-,-,-
"""soccer"" and ""analytics"" and ""world""",2016,10,Article,Grand challenge: real-time soccer analytics leveraging low-latency complex event processing,"In this paper, we present a real-time capable event-based system, which is tailored towards analytical query processing in the context of soccer games. The main challenge is to meet the application's strict real-time and low-latency requirements in face of streams of high-velocity sensor data. We describe a workflow-like architecture for query processing based on a publish/subscribe model. Queries are structured into computational tasks that are arranged sequentially and/or in parallel. Tasks are connected by preallocated ring buffers providing total event ordering and fast as well as decoupled event access. Our evaluation results show the effectiveness of the proposed system in terms of low-latency processing under real-time conditions. Speeding up the system by a factor of 50 compared to real-time introduces almost no latency overhead.",Proceedings of the 7th ACM international conference on Distributed event-based systems,"Jergler, M.","Doblander, C.","Najafi, M.","Jacobsen, H. A.",-,-,-,-,-,-,-,-,-,-
"""soccer"" and ""analytics"" and ""world""",2014,29,Article,What Businesses Can Learn From Sports Analytics,"The use of analytics in the sports world has much to teach managers about alignment, performance improvement and business ecosystems.",MIT Sloan Management Review,"Davenport, T. H.",-,-,-,-,-,-,-,-,-,-,-,-,-
"""soccer"" and ""analytics"" and ""world""",2013,235,Article,The numbers game: Why everything you know about soccer is wrong,no_abstract,Penguin,"Anderson, C.","Sally, D.",-,-,-,-,-,-,-,-,-,-,-,-
"""soccer"" and ""analytics"" and ""world""",2015,23,Article,Cutting-edge marketing analytics: Real world cases and data sets for hands on learning,no_abstract,Pearson Education,"Venkatesan, R.","Farris, P.","Wilcox, R. T.",-,-,-,-,-,-,-,-,-,-,-
"""soccer"" and ""analytics"" and ""world""",2015,8,Thesis,Applying machine learning to event data in soccer,"Soccer is the world's most popular sport but published research in soccer analytics has yet to attain the same level of sophistication as analytics in other professional sports. We hope to discover new knowledge from a soccer ball-event dataset by applying different machine learning techniques. In this thesis we present three experiments that address three interesting questions in soccer that involve game prediction and team style. We approach each question by constructing features using the ball-event data, where an event is a pass, shot, etc., and applying machine learning algorithms. In the first experiment, we construct three models that use different features to predict which team won a given game, without any knowledge of goals. We achieve a top accuracy rate of 0.84 using an L2-regularized logistic regression classifier. We also investigate the feature weights to learn relationships between game events and a team's chances of success. In the second experiment we try several classifiers to predict which team produced the sequence of ball-events that occurred during a game. Despite the relatively small number of events per game, we achieved an accuracy rate of 0.345 for a 20-team classification task when using a RBF SVM. By learning which sequences are characteristic of teams we are potentially able to discover if successful teams have a common style. We also learn the efficacy of transforming ball-events into predefined symbols. Finally, in the third experiment, we predict which team attempted a given set of passes. We first construct 2D histograms of the locations of the origins of the passes. We then use the histograms as features in a 20-team classification task and discover that teams have characteristic passing styles, by achieving an accuracy rate of 0.735 using a learned K-NN classifier. The results demonstrate that approaching soccer analytics with a machine learning framework is effective. In addition to achieving good classification performance, we are able to discover useful, potentially actionable, knowledge by investigating the models and features that we construct.",Massachusetts Institute of Technology,"Kerr, M. G. S.",-,-,-,-,-,-,-,-,-,-,-,-,-
"""soccer"" and ""analytics"" and ""world""",2015,77,Article,The harsh rule of the goals: Data-driven performance indicators for football teams,"Sports analytics in general, and football (soccer in USA) analytics in particular, have evolved in recent years in an amazing way, thanks to automated or semi-automated sensing technologies that provide high-fidelity data streams extracted from every game. In this paper we propose a data-driven approach and show that there is a large potential to boost the understanding of football team performance. From observational data of football games we extract a set of pass-based performance indicators and summarize them in the H indicator. We observe a strong correlation among the proposed indicator and the success of a team, and therefore perform a simulation on the four major European championships (78 teams, almost 1500 games). The outcome of each game in the championship was replaced by a synthetic outcome (win, loss or draw) based on the performance indicators computed for each team. We found that the final rankings in the simulated championships are very close to the actual rankings in the real championships, and show that teams with high ranking error show extreme values of a defense/attack efficiency measure, the Pezzali score. Our results are surprising given the simplicity of the proposed indicators, suggesting that a complex systems' view on football data has the potential of revealing hidden patterns and behavior of superior quality.",2015 IEEE International Conference on Data Science and Advanced Analytics (DSAA),"Cintia, P.","Giannotti, F.","Pappalardo, L.","Pedreschi, D.","Malvaldi, M.",-,-,-,-,-,-,-,-,-
"""soccer"" and ""analytics"" and ""world""",2015,55,Article,Challenges and Perspectives in Big Eye-Movement Data Visual Analytics,"Eye tracking has become an important technology to understand where and when people pay visual attention to a scene. Nowadays, eye tracking technology is moving from the laboratory to the real-world, producing more data at higher rates with extensive amounts of different data types. If this trend continues, eye tracking moves into the direction of big data. This requires developing new evaluation approaches beyond statistical analysis and visual inspection to find patterns in the data. As in big data analysis, visual analytics is one possible direction for eye movement data analysis. We look at current visual analytics methods and discuss how they can be applied to big eye-movement data. In this position paper we describe challenges for big eye-movement data visual analytics and discuss which techniques may be useful to address these challenges. Finally, we describe a number of potential scenarios for big eye-movement data.",2015 Big Data Visual Analytics (BDVA),"Blascheck, T.","Burch, M.","Raschke, M.","Weiskopf, D.",-,-,-,-,-,-,-,-,-,-
"""soccer"" and ""analytics"" and ""world""",2014,81,Article,Soccer video and player position dataset,"This paper presents a dataset of body-sensor traces and corresponding videos from several professional soccer games captured in late 2013 at the Alfheim Stadium in Tromsø, Norway. Player data, including field position, heading, and speed are sampled at 20Hz using the highly accurate ZXY Sport Tracking system. Additional per-player statistics, like total distance covered and distance covered in different speed classes, are also included with a 1Hz sampling rate. The provided videos are in high-definition and captured using two stationary camera arrays positioned at an elevated position above the tribune area close to the center of the field. The camera array is configured to cover the entire soccer field, and each camera can be used individually or as a stitched panorama video. This combination of body-sensor data and videos enables computer-vision algorithms for feature extraction, object tracking, background subtraction, and similar, to be tested against the ground truth contained in the sensor traces.",Proceedings of the 5th ACM Multimedia Systems Conference,"Pettersen, S. A.","Johansen, D.","Johansen, H.","Berg-Johansen, V.","Gaddam, V. R.","Mortensen, A.","Langseth, R.","Griwodz, C.","Stensland, H. K.","Halvorsen, P.",-,-,-,-
"""soccer"" and ""analytics"" and ""world""",2015,1,Article,Analysis of patterns of offensive of the Spanish National Soccer Team in the 2014 FIFA® World Cup,no_abstract,Revista Brasileira de Educação Física e Esporte,"SANTOS, R. D. M. M.","MORAES, E. L.","COSTA, I. T. D.",-,-,-,-,-,-,-,-,-,-,-
"""soccer"" and ""analytics"" and ""world""",2015,16,Article,Visual Analytics of Twitter Conversations about Corporate Sponsors of FC Barcelona and Juventus at the 2015 UEFA Final,"Until now, little research has been conducted to analyse Twitter conversations about the corporate sponsors of football clubs. The conventional and most widely used method has been to use content analysis to assess the sentiment of the tweets that were sent. However, this approach may be inadequate because sports fans may be unlikely to mention a corporate sponsor in the text they tweet. This study demonstrates the use of visual analytics to assess conversations about corporate sponsors by examining the images people tweet.",International Journal of Sports Marketing and Sponsorship.,"Jensen, R. W.","Limbu, Y. B.","Spong, Y.",-,-,-,-,-,-,-,-,-,-,-
"""soccer"" and ""analytics"" and ""world""",2013,153,Article,SoccerStories: A Kick-off for Visual Soccer Analysis,"This article presents SoccerStories, a visualization interface to support analysts in exploring soccer data and communicating interesting insights. Currently, most analyses on such data relate to statistics on individual players or teams. However, soccer analysts we collaborated with consider that quantitative analysis alone does not convey the right picture of the game, as context, player positions and phases of player actions are the most relevant aspects. We designed SoccerStories to support the current practice of soccer analysts and to enrich it, both in the analysis and communication stages. Our system provides an overview+detail interface of game phases, and their aggregation into a series of connected visualizations, each visualization being tailored for actions such as a series of passes or a goal attempt. To evaluate our tool, we ran two qualitative user studies on recent games using SoccerStories with data from one of the world's leading live sports data providers. The first study resulted in a series of four articles on soccer tactics, by a tactics analyst, who said he would not have been able to write these otherwise. The second study consisted in an exploratory follow-up to investigate design alternatives for embedding soccer phases into word-sized graphics. For both experiments, we received a very enthusiastic feedback and participants consider further use of SoccerStories to enhance their current workflow.",IEEE transactions on visualization and computer graphics,"Perin, C.","Vuillemot, R.","Fekete, J. D.",-,-,-,-,-,-,-,-,-,-,-
"""soccer"" and ""analytics"" and ""world""",2014,17,Article,Large-scale World Cup 2014 outcome prediction based on Tumblr posts,"With the 2014 FIFA World Cup kicking off on June 12th, billions of fans across the world have turned their attention toward host country Brazil to root for their teams. Soc- cer (or football, if you prefer) fans are loud; you need only remember the last World Cup’s infamous vuvuzelas for a demonstration. But fans are not only loud in stadiums. They also make their voices heard across social media. And though you may assume these fans are just blowing their vuvuzelas into the social abyss, if you listen closely, you will discover a treasure trove of data, including an answer to the most important question of all: ”Who will win?”. In this pa- per we use Tumblr posts collected during 4 months prior to the start of the World Cup to predict the outcome of every game. We describe the prediction algorithm as well as the analysis of the performance results, including comparison of the predictions of several competing methods.",KDD workshop on large-scale sports analytics,"Radosavljevic, V.","Grbovic, M.","Djuric, N.","Bhamidipati, N.",-,-,-,-,-,-,-,-,-,-
"""soccer"" and ""analytics"" and ""world""",2013,18,Article,Combining Video and Player Telemetry for Evidence-based Decisions in Soccer,"Technology is changing how soccer clubs train and interact with their supporters. Systems that provide ac- quisition and visualization of low-level player telemetry, like distance covered and speed, are already being widely adopted. A key observation is that such data when correlated with actual in-game video footage is a powerful tool for evidence-based decisions. As data volume and complexity grow, efficient tools for auto- mated high-precision retrieval become essential. This paper describes the unique combination of a radio-based sensor platform and several custom video retrieval systems in operational use at Tromsø Idrettslag (TIL), a Norwegian premier league soccer club. The systems have been developed using an experimental computer- science method where several prototypes were built and deployed for evaluation in close collaboration with the intended users. Although our method of computer-system prototyping has not yielded commercial quality products, it has enabled us to construct several novel systems combining low-level player telemetry with video retrieval, annotations, and user-centric security.",icSPORTS,"Johansen, H. D.","Pettersen, S. A.","Halvorsen, P.","Johansen, D.",-,-,-,-,-,-,-,-,-,-
