Query,Año,Citas,Type,Titulo,Abstract,Revista_or_evento,a_1,a_2,a_3,a_4,a_5,a_6,a_7,a_8,a_9,a_10,a_11,a_12,a_13,a_14
"""Machine"" and ""learning"" and ""SCIENTIST"" and ""SOCCER""",2017,10,Article,GPS Data Reflect Players’ Internal Load in Soccer,"The use of RPE as a measure of Internal load has become a common methodology used in team sports owing to its low cost. The aim of this study was to build a machine learning process able to describe the players' RPE by the external load extracted from the GPS. In this paper, we propose a multidimensional approach to assess the RPE in professional soccer which is based on GPS measurements and machine learning. By using GPS tracking technology, we collect data describing the training workload of players in a professional soccer club during a season. We show that our Ordinal predictor is both accurate and precise in medium RPE value (i.e., between 4 and 7) but it is not consistent in etreme value (i.e., below 4 and above 7). Our approach is a preliminary study that suggest that it is possible to predict players' RPE from GPS training and match data. However, these are not the only information needed to understand the players' effort perceived after a trainings or matches.",2017 IEEE International Conference on Data Mining Workshops (ICDMW),"Rossi, A.","Perri, E.","Trecroci, A.","Savino, M.","Alberti, G.","Iaia, F. M.",-,-,-,-,-,-,-,-
"""Machine"" and ""learning"" and ""SCIENTIST"" and ""SOCCER""",2018,6,Article,Deep Learning from Spatial Relations for Soccer Pass Prediction,"We propose a convolutional architecture for learning representations over spatial relations in the game of soccer, with the goal to predict individual passes between players, as a submission to the prediction challenge organized for the 5th Workshop on Machine Learning and Data Mining for Sports Analytics. The goal of the challenge was to predict the receiver of a pass given location of the sender and all other players. From each soccer situation, we extract spatial relations between the players and a few key locations on the field, which are then hierarchically aggregated within the neural architecture designed to extract possibly complex gameplay patterns stemming from these simple relations. The use of convolutions then allows to efficiently capture the various regularities that are inherent to the game. In the experiments, we show very promising performance of the method.",International workshop on machine learning and data mining for sports analytics,"Hubá?ek, O.","Šourek, G.","Železný, F.",-,-,-,-,-,-,-,-,-,-,-
"""Machine"" and ""learning"" and ""SCIENTIST"" and ""SOCCER""",2017,26,Article,Adaptive pattern recognition in real-time video-based soccer analysis,"Computer-aided sports analysis is demanded by coaches and the media. Image processing and machine learning techniques that allow for “live” recognition and tracking of players exist. But these methods are far from collecting and analyzing event data fully autonomously. To generate accurate results, human interaction is required at different stages including system setup, calibration, supervision of classifier training, and resolution of tracking conflicts. Furthermore, the real-time constraints are challenging: in contrast to other object recognition and tracking applications, we cannot treat data collection, annotation, and learning as an offline task. A semi-automatic labeling of training data and robust learning given few examples from unbalanced classes are required. We present a real-time system acquiring and analyzing video sequences from soccer matches. It estimates each player’s position throughout the whole match in real-time. Performance measures derived from these raw data allow for an objective evaluation of physical and tactical profiles of teams and individuals. The need for precise object recognition, the restricted working environment, and the technical limitations of a mobile setup are taken into account. Our contribution is twofold: (1) the deliberate use of machine learning and pattern recognition techniques allows us to achieve high classification accuracy in varying environments. We systematically evaluate combinations of image features and learning machines in the given online scenario. Switching between classifiers depending on the amount of training data and available training time improves robustness and efficiency. (2) A proper human–machine interface decreases the number of required operators who are incorporated into the system’s learning process. Their main task reduces to the identification of players in uncertain situations. Our experiments showed high performance in the classification task achieving an average error rate of 3 % on three real-world datasets. The system was proved to collect accurate tracking statistics throughout different soccer matches in real-time by incorporating two human operators only. We finally show how the resulting data can be used instantly for consumer applications and discuss further development in the context of behavior analysis.",Journal of Real-Time Image Processing,"Schlipsing, M.","Salmen, J.","Tschentscher, M.","Igel, C.",-,-,-,-,-,-,-,-,-,-
"""Machine"" and ""learning"" and ""SCIENTIST"" and ""SOCCER""",2018,14,Article,Using social network analysis and gradient boosting to develop a soccer win–lose prediction model,"We present the conceptual framework of a soccer win–lose prediction system (SWLPS) focused on passing distribution data (which is a representative characteristic of soccer) using social network analysis (SNA) and gradient boosting (GB). The general purpose of soccer predictions is to help the field supervisor design a strategy to win subsequent games using the derived information to improve and expand the coaching process. To implement and evaluate the proposed SWLPS, actual network indicators and predicted network indicators are generated using passing distribution data and SNA. The win–lose prediction is conducted using the GB machine learning technique. The performance of the SWLPS is analyzed through comparison with various machine learning techniques (i.e., support vector machine (SVM), neural network (NN), decision tree (DT), case-based reasoning (CBR), and logistic regression (LR)). The experimental results and analyses demonstrate that the network indicators generated through SNA can represent soccer team performance and that an accurate win–lose prediction system can be developed using GB technique.",Engineering Applications of Artificial Intelligence,"Cho, Y.","Yoon, J.","Lee, S.",-,-,-,-,-,-,-,-,-,-,-
"""Machine"" and ""learning"" and ""SCIENTIST"" and ""SOCCER""",2016,2,Article,Constraint programming and machine learning for interactive soccer analysis,"A soccer competition consists of n teams playing against each other in a league or tournament system, according to a single or double round-robin schedule. These competitions offer an excellent opportunity to model interesting problems related to questions that soccer fans frequently ask about their favourite teams. For instance, at some stage of the competition, fans might be interested in determining whether a given team still has chances of winning the competition (i.e., finishing first in a league or being within the first k teams in a tournament to qualify to the playoff). This problem relates to the elimination problem, which is NP-complete for the actual FIFA pointing rule system (0, 1, 3), zero point to a loss, one point to a tie, and three points to a win. In this paper, we combine constraint programming with machine learning to model a general soccer scenario in a real-time application.",International Conference on Learning and Intelligent Optimization,"Duque, R.","Díaz, J. F.","Arbelaez, A.",-,-,-,-,-,-,-,-,-,-,-
"""Machine"" and ""learning"" and ""SCIENTIST"" and ""SOCCER""",2017,7,Article,Who is going to get hurt? Predicting injuries in professional soccer,"Injury prevention has a fundamental role in professional soc- cer due to the high cost of recovery for players and the strong influence of injuries on a club’s performance. In this paper we provide a predic- tive model to prevent injuries of soccer players using a multidimensional approach based on GPS measurements and machine learning. In an evo- lutive scenario, where a soccer club starts collecting the data for the first time and updates the predictive model as the season goes by, our ap- proach can detect around half of the injuries, allowing the soccer club to save 70% of a season’s economic costs related to injuries. The proposed approach can be a valuable support for coaches, helping the soccer club to reduce injury incidence, save money and increase team performance.",MLSA@ PKDD/ECML,"Rossi, A.","Pappalardo, L.","Cintia, P.","Fernández, J.","Iaia, M. F.","Medina, D.",-,-,-,-,-,-,-,-
"""Machine"" and ""learning"" and ""SCIENTIST"" and ""SOCCER""",2017,19,Article,""" The Leicester City Fairytale?"" Utilizing New Soccer Analytics Tools to Compare Performance in the 15/16 & 16/17 EPL Seasons.","The last two years have been somewhat of a rollercoaster for English Premier League (EPL) team Leicester City. In the 2015/16 season, against all odds and logic, they won the league to much fan-fare. Fast-forward nine months later, and they are battling relegation. What could describe this fluctuating form? As soccer is a very complex and strategic game, common statistics (e.g., passes, shots, possession) do not really tell the full story on how a team succeeds and fails. However, using machine learning tools and a plethora of data, it is now possible to obtain some insights into how a team performs. To showcase the utility of these new tools (i.e., expected goal value, expected save value, strategy-plots and passing quality measures), we first analyze the EPL 2015/16 season which a specific emphasis on the champions Leicester City, and then compare it to the current one. Finally, we show how these features can be used to predict future performance.",Proceedings of the 23rd ACM SIGKDD International Conference on Knowledge Discovery and Data Mining,"Ruiz, H.","Power, P.","Wei, X.","Lucey, P.",-,-,-,-,-,-,-,-,-,-
"""Machine"" and ""learning"" and ""SCIENTIST"" and ""SOCCER""",2016,55,Article,Automatic soccer video event detection based on a deep neural network combined cnn and rnn.,"2016 IEEE 28th International Conference on Tools with Artificial Intelligence (ICTAISoccer video semantic analysis has attracted a lot of researchers in the last few years. Many methods of machine learning have been applied to this task and have achieved some positive results, but the neural network method has not yet been used to this task from now. Taking into account the advantages of Convolution Neural Network(CNN) in fully exploiting features and the ability of Recurrent Neural Network(RNN) in dealing with the temporal relation, we construct a deep neural network to detect soccer video event in this paper. First we determine the soccer video event boundary which we used Play-Break(PB) segment by the traditional method. Then we extract the semantic features of key frames from PB segment by pre-trained CNN, and at last use RNN to map the semantic features of PB to soccer event types, including goal, goal attempt, card and corner. Because there is no suitable and effective dataset, we classify soccer frame images into nine categories according to their different semantic views and then construct a dataset called Soccer Semantic Image Dataset(SSID) for training CNN. The sufficient experiments evaluated on 30 soccer match videos demonstrate the effectiveness of our method than state-of-art methods.",2016 IEEE 28th International Conference on Tools with Artificial Intelligence (ICTAI),"Jiang, H.","Lu, Y.","Xue, J.",-,-,-,-,-,-,-,-,-,-,-
"""Machine"" and ""learning"" and ""SCIENTIST"" and ""SOCCER""",2018,10,Article,Learning Deep C3D Features For Soccer Video Event Detection,"Soccer video event identification has been an interesting task in research community during past few decades. Numerous machine learning techniques and C2D (Convolution 2-dimensional) have been used for this problem, but C3D has not been implemented for this task. By taking advantage from C3D (Convolution 3-dimensional), to completely exploit spatio-temporal relation, deep convolution network is developed to highlight distinct video events in proposed research work. Initially, we detect soccer video event marks by pixel differencing and edge change ratio. After this semantic features of segmented frames are extracted followed by CNN to map soccer event categories: Corner, Shoot, Goal Attempt, Penalty Kick. Because no effective and suitable dataset is available, we categorized soccer videos into four classes and developed soccer videos dataset for training CNN network. Evaluation results on soccer match clips generated results with high efficiency.",2018 14th International Conference on Emerging Technologies (ICET),"Khan, M. Z.","Saleem, S.","Hassan, M. A.","Khan, M. U. G.",-,-,-,-,-,-,-,-,-,-
"""Machine"" and ""learning"" and ""SCIENTIST"" and ""SOCCER""",2017,21,Article,Fast and precise black and white ball detection for robocup soccer,"In 2016, UT Austin Villa claimed the Standard Platform League’s second place position at the RoboCup International Robot Soccer Competition in Leipzig, Germany as well as first place at both the RoboCup US Open in Brunswick, USA and the World RoboCup Conference in Beijing, China. This paper describes some of the key contributions that led to the team’s victories with a primary focus on our techniques for identifying and tracking black and white soccer balls. UT Austin Villa’s ball detection system was overhauled in order to transition from the league’s bright orange ball, used every year of the competition prior to 2016, to the truncated icosahedral pattern commonly associated with soccer balls. We evaluated and applied a series of heuristic region-of-interest identification techniques and supervised machine learning methods to produce a ball detector capable of reliably detecting the ball’s position with no prior knowledge of the ball’s position. In 2016, UT Austin Villa suffered only a single loss which occurred after regulation time during a penalty kick shootout. We attribute much of UT Austin Villa’s success in 2016 to our robots’ effectiveness at quickly and consistently localizing the ball. In this work we discuss the specifics of UT Austin Villa’s ball detector implementation which are applicable to the specific problem of ball detection in RoboCup, as well as to the more general problem of fast and precise object detection in computationally constrained domains. Furthermore we provide empirical analyses of our approach to support the conclusion that modern deep learning techniques can enhance visual recognition tasks even in the face of these computational constraints.",Robot world cup,"Menashe, J.","Kelle, J.","Genter, K.","Hanna, J.","Liebman, E.","Narvekar, S.","Zhang, R.","Stone, P.",-,-,-,-,-,-
"""Machine"" and ""learning"" and ""SCIENTIST"" and ""SOCCER""",2018,28,Article,An adaptive strategy selection method with reinforcement learning for robotic soccer games,"Robotic soccer games, which have become popular, require timely and precise decisionmaking in a dynamic environment. To address the problems of complexity in a critical situation, policy improvement in robotic soccer games must occur. This paper proposes an adaptive decisionmaking method that uses reinforcement learning (RL), and the decision-making system for a robotic soccer game is composed of two subsystems. The first subsystem in the architecture for the proposed method criticizes the situation, and the second subsystem implements decision-making policy. Inspired by the support vector machine (SVM), a situation classification method, which is called an improved SVM, embeds a decision tree structure and simultaneously addresses the problems of a large scale and multiple classifications. When a variety of situations that are collected in the field are classified and congregated into the tree structure, the problem of local strategy selection for each individual class of situations over time is regarded as a RL problem and is solved using a Q-learning method. The results of simulations and experiments demonstrate that the proposed method allows satisfactory decision-making.",IEEE,"Shi, H.","Lin, Z.","Hwang, K. S.","Yang, S.","Chen, J.",-,-,-,-,-,-,-,-,-
"""Machine"" and ""learning"" and ""SCIENTIST"" and ""SOCCER""",2016,7,Article,Using Machine Learning approaches to detect opponent formation,"Making a correct decision is a difficult task in a Soccer Simulation 2D environment due to the fact that there is a lack of information for each agent. Therefore, coach agent can take role as a mediator for agents to analyze data and inform players about crucial events by sending command messages. This paper proposes a new method to detect the formation of opponents which is not still possible for agents to extract. In the experimental results of this paper, we show that team formation is successfully learned by various well-known classification algorithms.",2016 Artificial Intelligence and Robotics (IRANOPEN),"Asali, E.","Valipour, M.","Zare, N.","Afshar, A.","Katebzadeh, M.","Dastghaibyfard, G. H.",-,-,-,-,-,-,-,-
machine learning soccer prediction,2018,34,Article,Incorporating domain knowledge in machine learning for soccer outcome prediction,"The task of the 2017 Soccer Prediction Challenge was to use machine learning to predict the outcome of future soccer matches based on a data set describing the match outcomes of 216,743 past soccer matches. One of the goals of the Challenge was to gauge where the limits of predictability lie with this type of commonly available data. Another goal was to pose a real-world machine learning challenge with a fixed time line, involving the prediction of real future events. Here, we present two novel ideas for integrating soccer domain knowledge into the modeling process. Based on these ideas, we developed two new feature engineering methods for match outcome prediction, which we denote as recency feature extraction and rating feature learning. Using these methods, we constructed two learning sets from the Challenge data. The top-ranking model of the 2017 Soccer Prediction Challenge was our k-nearest neighbor model trained on the rating feature learning set. In further experiments, we could slightly improve on this performance with an ensemble of extreme gradient boosted trees (XGBoost). Our study suggests that a key factor in soccer match outcome prediction lies in the successful incorporation of domain knowledge into the machine learning modeling process.",Machine learning,"Berrar, D.","Lopes, P.","Dubitzky, W.",-,-,-,-,-,-,-,-,-,-,-
machine learning soccer prediction,2021,1,Article,Soccer Result Prediction Using Deep Learning and Neural Networks,"In the present world, the prediction of the results of football matches is being done by both machines and football experts. Football as a game produces a huge amount of statistical data about the players of the team; the matches played between the teams and the environment in which the match is being played. This statistical data can be exploited using various machine learning techniques to predict various information related to a particular football match, namely the result of a particular game, injury of a player, performance of a player in a particular match, and spotting new talents in the game, etc. In this work, previous works are reviewed on the prediction of the outcome of a football match, evaluate the merits and demerits of different approaches and then attempt to design a prediction system powered by Recurrent Neural Networks (RNNs) and Long Short Term Memory (LSTMs).",Intelligent Data Communication Technologies and Internet of Things,"Jain, S.","Tiwari, E.","Sardar, P.",-,-,-,-,-,-,-,-,-,-,-
machine learning soccer prediction,2019,1,Article,Can Machine Learning Predict Soccer Match Results?,"Sport result prediction proposes an interesting challenge considering as popular and widespread are sport games, for instance tennis and soccer. The outcome prediction is a difficult task because there are a lot of factors that can afflict the final results and most of them are related to the player human behaviour. In this paper we propose a new feature set (related to the match and to players) aimed to model a soccer match. The set is related to characteristics obtainable not only at the end of the match, but also when the match is in progress. We consider machine learning techniques to predict the results of the match and the number of goals, evaluating a dataset of real-world data obtained from the Italian Serie A league in the 2017-2018 season. Using the RandomForest algorithm we obtain a precision of 0.857 and a recall of 0.750 in won match prediction, while for the goal prediction we obtain a precision of 0.879 in the number of goal prediction less than two, and a precision of 0.8 in the number of goal prediction equal or greater to two.",ICAART,"Capobianco, G.","Di Giacomo, U.","Mercaldo, F.","Nardone, V.","Santone, A.",-,-,-,-,-,-,-,-,-
machine learning soccer prediction,2020,0,Article,Prediction of Results of a so Soccer Match at the World Cup Using Backpropagation Artificial Neural Network,"Prediction of the results of a soccer match is carried out using several variables such as historical data. Even though the score in a soccer match cannot be predicted, however, match statistics and previous match patterns can be used to predict the outcome of the next match. So that it can help the team to evaluate and prepare strategies before competing against the opposing team. In this study, a model was made to predict match results based on historical data from FIFA world cup match results, using one of the Artificial Neural Network (ANN) algorithms, Backpropagation. The results showed the prediction of soccer results in the world cup using Backpropagation Artificial Neural Networks produces an accuracy of 80.78%.",Proceedings of the 5th NA International Conference on Industrial Engineering and Operations Management,"Rajib, F.","Djamal, E. C.","Kasyidi, F.","Bon, A. T.",-,-,-,-,-,-,-,-,-,-
"""soccer"" and ""analytics"" and ""world"" and ""economics""",2014,0,Book,Applied Game Theory in Business Analytics,no_abstract,Encyclopedia of Business Analytics and Optimization,"Fox, W. P.",-,-,-,-,-,-,-,-,-,-,-,-,-
"""soccer"" and ""analytics"" and ""world"" and ""economics""",2015,38,Book,Sports analytics and data science: winning the game with methods and models,no_abstract,FT Press,"Miller, T. W.",-,-,-,-,-,-,-,-,-,-,-,-,-
"""soccer"" and ""analytics"" and ""world"" and ""economics""",2015,29,Article,The sports bribery act: a law and economics approach,"Sports bribery and match-fixing have become a part of the on-going sports news cycle. European and Asian match-fixing scandals in soccer, cricket and tennis have rocked the sports world recently. The 1919 Black Sox World Series scandal and the 1970's Boston College point shaving incidents have illustrated that the manipulation of sporting events is a global scourge. This paper examines the corruption cases that led to the 1964 passage of the Sports Bribery Act (18 U.S.C. § 224). We discuss the scope of the statute, its operation with complementary and ancillary federal and state laws, and the reported instances of the statute's application. The economic discussion focuses on Becker's model for optimal deterrence, its application to the Sports Bribery Act, and an examination of the implications regarding the utility for would-be match-fixers. The paper concludes with a discussion of the challenges facing a policy change, including the complexity of regulating both professional and amateur sport, methods of detection, and jurisdictional issues raised by the global nature of match-fixing.",Gaming Law Review and Economics,"Feustel, E. D.","Rodenberg, R. M.",-,-,-,-,-,-,-,-,-,-,-,-
"""soccer"" and ""analytics"" and ""world"" and ""economics""",2015,7,Article,Identify the reasons for the success or failure of countries in the Olympics,"Based upon conflicting of economic, social, cultural, and ecological indices role on sports medals, this study was conducted to identify influential factors of countries performance in Olympics games. The present study was performed as a descriptive- analytical field design during 2000, 2004, 2008 to 2012. The statistical sample was equal to population and consisted of 297 the countries . The number of medals was determined as the sport performance of each Country. The Data of Gross Domestic production (GDP), population, life expectancy (LE), Convoy size and Hosting were determined by a questionnaire. The normal data was analyzed by the multiple regression method at ?? 0.05. Convoy size (t=-1.764, p=0.049), life expectancy (t=2.277, p=0.010) and population () in interaction together have effect on the championship sport performance. According to the results, it can conclude that the increase of Convoy size, Obtaining hosting and improve health indicators (life expectancy) have effect on improvement the Sport performance of countries. Therefore, the essential planning is recommended to improve the influential factors and eliminate impediments of sports performance in international fields.",Scientific Journal Of Organizational Behavior Management in Sport Studies,"Askarian, F.","Dokhtbagher, N.",-,-,-,-,-,-,-,-,-,-,-,-
